{
  "$schema": "./schema.json",
  "ruleSet": "app-review",
  "dataVersion": "2026.10.28",
  "read": "2026-10-28",
  "requirements": {
    "xcode": {
      "minimum": "26",
      "since": "2026-04-28",
      "text": "Apps uploaded to App Store Connect must be built with Xcode 26 or later using the iOS 26 SDK."
    },
    "deploymentTarget": {
      "minimum": "13.0",
      "since": "2026-09-09",
      "text": "iOS and iPadOS apps uploaded to App Store Connect must target iOS 13 or later."
    }
  },
  "rules": [
    {
      "id": "RVW101",
      "severity": "error",
      "title": "Purpose string missing",
      "summary": "The app's code or a package it ships uses a protected resource, and the Info.plist has no purpose string for it. App Review rejects apps that contain code accessing a protected resource without one, including code in libraries the app does not call, and the app can crash when it asks for access.",
      "sources": [
        {
          "title": "Apple: Requesting access to protected resources",
          "url": "https://developer.apple.com/documentation/uikit/requesting-access-to-protected-resources"
        },
        {
          "title": "App Review Guidelines 5.1.1(ii) Permission",
          "url": "https://developer.apple.com/app-store/review/guidelines/#data-collection-and-storage"
        }
      ],
      "fixes": {
        "info-plist": {
          "title": "Add the key to Info.plist",
          "steps": [
            "Add the key to the target's Info.plist with one sentence that says what the app does with the data, for example: <key>NSCameraUsageDescription</key><string>Scan the barcode on a receipt to add it to your expenses.</string>",
            "If the app never uses this feature, remove the code or the package that uses it instead."
          ],
          "guide": "docs/guides/purpose-strings.md"
        },
        "build-setting": {
          "title": "Add the key in the target's Info tab",
          "steps": [
            "In Xcode, select the target, open Info, and add the key with a sentence that says what the app does with the data. Xcode stores it as the INFOPLIST_KEY_<key> build setting.",
            "If the app never uses this feature, remove the code or the package that uses it instead."
          ],
          "guide": "docs/guides/purpose-strings.md"
        },
        "expo-config": {
          "title": "Set the text in app.json",
          "steps": [
            "Set the key under expo.ios.infoPlist in app.json, or pass the text to the package's config plugin option, with a sentence that says what the app does with the data.",
            "Run npx expo prebuild --clean (or the next EAS Build) so the native Info.plist gets it."
          ],
          "guide": "docs/guides/purpose-strings.md"
        }
      }
    },
    {
      "id": "RVW102",
      "severity": "warning",
      "title": "Purpose string missing for a package feature",
      "summary": "A package the app ships needs a purpose string for one of its features (for example recording video with the camera picker). If the app uses that feature, the key is required; if it does not, nothing needs to change.",
      "sources": [
        {
          "title": "Apple: Requesting access to protected resources",
          "url": "https://developer.apple.com/documentation/uikit/requesting-access-to-protected-resources"
        }
      ],
      "fixes": {
        "info-plist": {
          "title": "Add the key if the app uses the feature",
          "steps": [
            "If the app uses the feature the finding names, add the key to Info.plist with a sentence that says what the app does with the data.",
            "If it does not, leave the Info.plist as it is and turn the finding off with --ignore RVW102."
          ],
          "guide": "docs/guides/purpose-strings.md"
        },
        "expo-config": {
          "title": "Set the text in app.json if the app uses the feature",
          "steps": [
            "If the app uses the feature, set the key under expo.ios.infoPlist in app.json or through the package's config plugin option.",
            "If it does not, leave app.json as it is and turn the finding off with --ignore RVW102."
          ],
          "guide": "docs/guides/purpose-strings.md"
        }
      }
    },
    {
      "id": "RVW103",
      "severity": "error",
      "title": "Purpose string not valid",
      "summary": "Apple's requirements for a purpose string: it is not blank or only whitespace, it is shorter than 4,000 bytes, and it has the type the key requires (a string).",
      "sources": [
        {
          "title": "Apple: Adhere to the requirements for purpose strings",
          "url": "https://developer.apple.com/documentation/uikit/requesting-access-to-protected-resources"
        }
      ],
      "fixes": {
        "info-plist": {
          "title": "Write a one-sentence string",
          "steps": [
            "Make the value a <string> of one complete sentence that says what the app does with the data, well under 4,000 bytes."
          ],
          "guide": "docs/guides/purpose-strings.md"
        },
        "build-setting": {
          "title": "Write a one-sentence string",
          "steps": [
            "Set the INFOPLIST_KEY_<key> build setting (target > Info in Xcode) to one complete sentence that says what the app does with the data."
          ],
          "guide": "docs/guides/purpose-strings.md"
        },
        "expo-config": {
          "title": "Write a one-sentence string",
          "steps": [
            "Set the key in expo.ios.infoPlist to a string of one complete sentence that says what the app does with the data."
          ],
          "guide": "docs/guides/purpose-strings.md"
        }
      }
    },
    {
      "id": "RVW104",
      "severity": "warning",
      "title": "Purpose string is placeholder or default text",
      "summary": "The purpose string is a placeholder, a sample from a package's README, or the default text a config plugin writes when the app gives none. Apple asks for a description that is accurate, meaningful and specific about why the app needs access, and guideline 5.1.1(ii) asks purpose strings to clearly and completely describe the use of the data.",
      "sources": [
        {
          "title": "Apple: Adhere to the requirements for purpose strings",
          "url": "https://developer.apple.com/documentation/uikit/requesting-access-to-protected-resources"
        },
        {
          "title": "App Review Guidelines 5.1.1(ii) Permission",
          "url": "https://developer.apple.com/app-store/review/guidelines/#data-collection-and-storage"
        }
      ],
      "fixes": {
        "info-plist": {
          "title": "Say why the app needs access",
          "steps": [
            "Replace the text with one sentence that names what the app does with the data, for example \"Take a photo of your meal to log it\" rather than \"needs camera access\"."
          ],
          "guide": "docs/guides/purpose-strings.md"
        },
        "expo-config": {
          "title": "Pass your own text to the config plugin",
          "steps": [
            "Add the plugin to expo.plugins with its permission option, for example [\"expo-camera\", { \"cameraPermission\": \"Scan a receipt to add it to your expenses.\" }], or set the key under expo.ios.infoPlist.",
            "Set the option to false instead if the app never uses that permission: the plugin then leaves the key out."
          ],
          "guide": "docs/guides/purpose-strings.md"
        }
      }
    },
    {
      "id": "RVW201",
      "severity": "warning",
      "title": "Export compliance not declared",
      "summary": "The Info.plist has no ITSAppUsesNonExemptEncryption key, so App Store Connect walks you through the export compliance questions every time you upload a new version, and the build waits for the answer before it can go to TestFlight or review.",
      "sources": [
        {
          "title": "Apple: ITSAppUsesNonExemptEncryption",
          "url": "https://developer.apple.com/documentation/bundleresources/information-property-list/itsappusesnonexemptencryption"
        },
        {
          "title": "Apple: Complying with Encryption Export Regulations",
          "url": "https://developer.apple.com/documentation/security/complying-with-encryption-export-regulations"
        }
      ],
      "fixes": {
        "info-plist": {
          "title": "Declare the app's encryption",
          "steps": [
            "If the app (with its libraries) uses no encryption, or only the encryption built into the operating system such as HTTPS through URLSession, add <key>ITSAppUsesNonExemptEncryption</key><false/>.",
            "If it uses non-exempt encryption, set it to <true/> and add ITSEncryptionExportComplianceCode with the code Apple gives you after reviewing your documentation."
          ],
          "guide": "docs/guides/export-compliance.md"
        },
        "build-setting": {
          "title": "Declare the app's encryption",
          "steps": [
            "Set the INFOPLIST_KEY_ITSAppUsesNonExemptEncryption build setting to NO if the app uses no encryption or only exempt encryption such as HTTPS, or to YES with ITSEncryptionExportComplianceCode otherwise."
          ],
          "guide": "docs/guides/export-compliance.md"
        },
        "expo-config": {
          "title": "Declare the app's encryption in app.json",
          "steps": [
            "Set expo.ios.config.usesNonExemptEncryption to false if the app uses no encryption or only exempt encryption such as HTTPS, or to true and follow Apple's documentation otherwise."
          ],
          "guide": "docs/guides/export-compliance.md"
        }
      }
    },
    {
      "id": "RVW301",
      "severity": "warning",
      "title": "Account creation without account deletion",